"function_id","tab_family","purpose","telegram_future"
"SYSTEM_STATUS","estado","ver que esta activo, pausado, listo o bloqueado","consultar /estado"
"HUMAN_GATES","gates","registrar decisiones humanas antes de acciones sensibles","mostrar gates y pedir autorizacion"
"RUN_HISTORY","runs","historial de ejecuciones, readiness, errores y cierres","consultar ultimo run"
"TASK_QUEUE","tareas","ordenar tareas internas, prioridad, owner y estado","consultar y crear tareas"
"OPERATIONAL_DICTIONARY","diccionario","nombres oficiales, scopes, criterios y comandos","resolver terminos y comandos"
"HUMAN_MANUAL","manual","instrucciones de uso sin depender de memoria conversacional","ayuda guiada"
"RISK_SUPERVISION","riesgos","controlar workers reales, API, push, secretos y acciones externas","alertas y bloqueos"
"TELEGRAM_BRIDGE_READY","bridge","dejar Telegram como capa sobre Sheets, no como cerebro paralelo","router sobre modelo Sheets"
