"rule_id","rule","failure_state"
"QUEUE-ENTRY-001","source_record_id debe existir y no estar vacio","BLOCKED"
"QUEUE-ENTRY-002","requested_action debe pertenecer al contrato de acciones humanas","BLOCKED"
"QUEUE-ENTRY-003","priority_score debe estar entre 0 y 100","BLOCKED"
"QUEUE-ENTRY-004","cada source_record_id solo puede tener un elemento activo","BLOCKED"
"QUEUE-ENTRY-005","la entrada en cola no puede ejecutar acciones externas","BLOCKED"
"QUEUE-ENTRY-006","la revision debe conservar trazabilidad append-only","BLOCKED"
"QUEUE-ENTRY-007","una aprobacion humana solo registra decision","BLOCKED"
"QUEUE-ENTRY-008","la escritura real en Sheets queda prohibida en este bloque","BLOCKED"
